{
  "code": "DL-12",
  "name": "NOROSHI",
  "aka": "SIGNAL",
  "ovp_version": "1.0",
  "status": "candidate",
  "philosophy": {
    "civilization": "Japan",
    "principle": "Alert and escalation",
    "motto": "Signal only what matters.",
    "laws": [
      "Immediate verdict",
      "Exception-focused",
      "Maximum clarity",
      "Minimal content",
      "Ownership always assigned"
    ],
    "related": [
      "Beacon",
      "Sentinel"
    ]
  },
  "constitution": {
    "narrative_style": "recommendation-first",
    "density": "executive",
    "annotation_policy": "minimal",
    "legend_policy": "direct-labels-only",
    "highlight_policy": "single",
    "decision_style": "recommendation-with-owner",
    "reading_time": "glance",
    "charts_per_page": 1
  },
  "occasions": [
    "escalations",
    "flash reports",
    "exception one-pagers",
    "morning briefs"
  ],
  "palette": {
    "background": "#FFFFFF",
    "ink": "#0F172A",
    "body": "#475569",
    "hairline": "#E2E8F0",
    "gridline": "#E2E8F0",
    "primary": "#D63A2F",
    "muted": "#94A3B8",
    "positive": "#1F7A4D",
    "negative": "#D63A2F",
    "warning": "#B45309"
  },
  "fonts": {
    "display": {
      "family": "'Segoe UI',Arial,sans-serif",
      "weight": 700
    },
    "body": {
      "family": "'Segoe UI',Arial,sans-serif",
      "weight": 400
    }
  },
  "chrome": {
    "kicker": false,
    "eyebrow": false
  }
}
