{
  "code": "DL-04",
  "name": "SHILPA",
  "aka": "BLUEPRINT",
  "ovp_version": "1.0",
  "status": "adopted",
  "philosophy": {
    "civilization": "India",
    "principle": "Craftsmanship and structure",
    "motto": "Craft every detail.",
    "laws": [
      "Precision before aesthetics",
      "Standards are sacred",
      "Components align",
      "Geometry is functional",
      "IDs remain machine-readable"
    ],
    "related": [
      "Techne",
      "Canon"
    ]
  },
  "constitution": {
    "narrative_style": "evidence-first",
    "density": "scientific",
    "annotation_policy": "full",
    "legend_policy": "level-key-allowed",
    "highlight_policy": "single",
    "decision_style": "options",
    "reading_time": "session",
    "charts_per_page": 4
  },
  "occasions": [
    "technical packs",
    "procedures",
    "job cards",
    "commissioning annexes"
  ],
  "palette": {
    "background": "#FBFDFF",
    "panel": "#EDF3F7",
    "ink": "#143D59",
    "body": "#33424E",
    "hairline": "#C6D5E0",
    "gridline": "#E7EEF4",
    "primary": "#1B6E8F",
    "muted": "#C6D5E0",
    "positive": "#2E6E4E",
    "negative": "#9E2B25",
    "warning": "#B54708"
  },
  "fonts": {
    "display": {
      "family": "'Segoe UI',Arial,sans-serif",
      "weight": 600
    },
    "body": {
      "family": "'Segoe UI',Arial,sans-serif",
      "weight": 400
    },
    "mono": {
      "family": "Consolas,monospace",
      "weight": 400
    }
  },
  "chrome": {
    "kicker": false,
    "eyebrow": false
  }
}
