{
  "code": "DL-15",
  "name": "ABRID",
  "aka": "MATRIX",
  "ovp_version": "1.0",
  "status": "candidate",
  "philosophy": {
    "civilization": "Amazigh",
    "principle": "Connection and pathways",
    "motto": "Everything is connected.",
    "laws": [
      "Relationships first",
      "Structure reveals insight",
      "Connections are explicit",
      "Frameworks simplify complexity",
      "Navigation through ideas"
    ],
    "related": [
      "Mandala",
      "Bagua",
      "Network"
    ]
  },
  "constitution": {
    "narrative_style": "question-first",
    "density": "operational",
    "annotation_policy": "guided",
    "legend_policy": "direct-labels-only",
    "highlight_policy": "single",
    "decision_style": "options",
    "reading_time": "session",
    "charts_per_page": 2
  },
  "occasions": [
    "framework decks",
    "portfolio reviews",
    "strategy workshops"
  ],
  "palette": {
    "background": "#FFFFFF",
    "ink": "#0E3A2C",
    "body": "#3E4C46",
    "hairline": "#C9D2CC",
    "gridline": "#E5E7E2",
    "primary": "#197A56",
    "muted": "#A7C4B5",
    "positive": "#197A56",
    "negative": "#9E2B25"
  },
  "fonts": {
    "display": {
      "family": "'Segoe UI',Arial,sans-serif",
      "weight": 700
    },
    "body": {
      "family": "'Segoe UI',Arial,sans-serif",
      "weight": 400
    }
  },
  "chrome": {
    "kicker": false,
    "eyebrow": false
  }
}
