{
  "code": "DL-08",
  "name": "SENTINEL",
  "aka": "TERMINAL",
  "ovp_version": "1.0",
  "status": "candidate",
  "philosophy": {
    "civilization": "Latin tradition",
    "principle": "Vigilance",
    "motto": "Watch without distraction.",
    "laws": [
      "Constant visibility",
      "One highlighted watch metric",
      "Dark environments",
      "Fast scanning",
      "Low cognitive load"
    ],
    "related": [
      "Pharos",
      "Vegvisir"
    ]
  },
  "constitution": {
    "narrative_style": "question-first",
    "density": "operational",
    "annotation_policy": "minimal",
    "legend_policy": "direct-labels-only",
    "highlight_policy": "single",
    "decision_style": "evidence-only",
    "reading_time": "glance",
    "charts_per_page": 4
  },
  "occasions": [
    "live dashboards",
    "control-room screens",
    "dark BI pages",
    "monitoring walls"
  ],
  "palette": {
    "background": "#101418",
    "panel": "#1A2026",
    "ink": "#E6EDF3",
    "body": "#9FB0BE",
    "hairline": "#2A323A",
    "gridline": "#2A323A",
    "primary": "#F0B429",
    "muted": "#5C6B78",
    "benchmark": "#9FB0BE",
    "positive": "#3FB68B",
    "negative": "#E5534B",
    "info": "#58A6FF"
  },
  "fonts": {
    "display": {
      "family": "'Segoe UI',Arial,sans-serif",
      "weight": 600
    },
    "body": {
      "family": "'Segoe UI',Arial,sans-serif",
      "weight": 400
    },
    "mono": {
      "family": "Consolas,monospace",
      "weight": 400
    }
  },
  "chrome": {
    "kicker": false,
    "eyebrow": false
  }
}
