{
  "code": "DL-11",
  "name": "SUTRA",
  "aka": "MEMO",
  "ovp_version": "1.0",
  "status": "candidate",
  "philosophy": {
    "civilization": "India",
    "principle": "Condensed knowledge",
    "motto": "Complexity distilled.",
    "laws": [
      "Brevity with clarity",
      "Structured hierarchy",
      "Recommendation concludes",
      "Supporting evidence remains concise"
    ],
    "related": [
      "Codex",
      "Mneme"
    ]
  },
  "constitution": {
    "narrative_style": "recommendation-first",
    "density": "executive",
    "annotation_policy": "minimal",
    "legend_policy": "direct-labels-only",
    "highlight_policy": "single",
    "decision_style": "recommendation-with-owner",
    "reading_time": "minute",
    "charts_per_page": 1
  },
  "occasions": [
    "briefing notes",
    "position papers",
    "board memos",
    "formal letters"
  ],
  "palette": {
    "background": "#FFFFFF",
    "ink": "#1F3864",
    "body": "#262626",
    "hairline": "#8EAADB",
    "gridline": "#C9D6EE",
    "primary": "#1F3864",
    "muted": "#A9BBD9",
    "positive": "#2E6E4E",
    "negative": "#9E2B25"
  },
  "fonts": {
    "display": {
      "family": "Cambria,Georgia,serif",
      "weight": 700
    },
    "body": {
      "family": "Cambria,Georgia,serif",
      "weight": 400
    }
  },
  "chrome": {
    "kicker": false,
    "eyebrow": false
  }
}
