{
  "code": "DL-07",
  "name": "SAGA",
  "aka": "GAZETTE",
  "ovp_version": "1.0",
  "status": "candidate",
  "philosophy": {
    "civilization": "Nordic",
    "principle": "History and continuity",
    "motto": "Every report becomes history.",
    "laws": [
      "Narrative hierarchy",
      "Time is explicit",
      "Trends over snapshots",
      "Headlines tell the story",
      "Archive-friendly formatting"
    ],
    "related": [
      "Chronicle",
      "Annals",
      "Tarikh"
    ]
  },
  "constitution": {
    "narrative_style": "story-first",
    "density": "operational",
    "annotation_policy": "guided",
    "legend_policy": "direct-labels-only",
    "highlight_policy": "single",
    "decision_style": "evidence-only",
    "reading_time": "minute",
    "charts_per_page": 2
  },
  "occasions": [
    "weekly digests",
    "bulletins",
    "newsletters",
    "reading pages"
  ],
  "palette": {
    "background": "#FFFFFF",
    "ink": "#111111",
    "body": "#2E2E2E",
    "hairline": "#111111",
    "gridline": "#E4E4E4",
    "primary": "#C0182B",
    "muted": "#B0B0B0",
    "positive": "#2E2E2E",
    "negative": "#C0182B"
  },
  "fonts": {
    "display": {
      "family": "Georgia,serif",
      "weight": 700
    },
    "body": {
      "family": "'Segoe UI',Arial,sans-serif",
      "weight": 400
    }
  },
  "chrome": {
    "kicker": false,
    "eyebrow": false
  }
}
