{
  "code": "DL-01",
  "name": "AGRAW",
  "aka": "BOARDROOM",
  "ovp_version": "1.0",
  "status": "adopted",
  "philosophy": {
    "civilization": "Amazigh (Berber)",
    "principle": "Leadership and collective governance",
    "motto": "Lead with wisdom.",
    "laws": [
      "One governing message per page",
      "Authority through restraint",
      "One focal metric or chart",
      "Evidence supports every conclusion",
      "Minimal decoration"
    ],
    "related": [
      "Shura",
      "Auctoritas",
      "Ubuntu"
    ]
  },
  "constitution": {
    "narrative_style": "recommendation-first",
    "density": "executive",
    "annotation_policy": "minimal",
    "legend_policy": "direct-labels-only",
    "highlight_policy": "single",
    "decision_style": "recommendation-with-owner",
    "reading_time": "minute",
    "charts_per_page": 1
  },
  "occasions": [
    "board packs",
    "steering committees",
    "shareholder reviews",
    "exec monthlies"
  ],
  "palette": {
    "background": "#FFFFFF",
    "panel": "#FAFAF7",
    "ink": "#1A1A1A",
    "body": "#3D3D3D",
    "hairline": "#D8D5CE",
    "gridline": "#EFEDE8",
    "primary": "#008080",
    "muted": "#C9C6BF",
    "positive": "#2E6E4E",
    "negative": "#8B1E1E"
  },
  "fonts": {
    "display": {
      "family": "'EB Garamond',Georgia,serif",
      "weight": 600
    },
    "body": {
      "family": "'Segoe UI',Arial,sans-serif",
      "weight": 400
    }
  },
  "chrome": {
    "kicker": false,
    "eyebrow": false
  }
}
