{
  "code": "DL-05",
  "name": "OBEYA",
  "aka": "FIELD",
  "ovp_version": "1.0",
  "status": "adopted",
  "philosophy": {
    "civilization": "Japan",
    "principle": "Collaboration and shared visibility",
    "motto": "See together. Decide together.",
    "laws": [
      "Information remains visible",
      "Ownership is explicit",
      "Progress is collaborative",
      "Large readable typography",
      "Decisions happen around the information"
    ],
    "related": [
      "Twiza",
      "Ubuntu",
      "Harambee"
    ]
  },
  "constitution": {
    "narrative_style": "question-first",
    "density": "operational",
    "annotation_policy": "minimal",
    "legend_policy": "direct-labels-only",
    "highlight_policy": "dual",
    "decision_style": "options",
    "reading_time": "glance",
    "charts_per_page": 4
  },
  "occasions": [
    "stand-up boards",
    "site wall prints",
    "war rooms",
    "A3 posters"
  ],
  "palette": {
    "background": "#FFFFFF",
    "ink": "#0F172A",
    "body": "#334155",
    "hairline": "#64748B",
    "gridline": "#CBD5E1",
    "primary": "#C2410C",
    "muted": "#64748B",
    "positive": "#1F7A4D",
    "negative": "#B91C1C"
  },
  "fonts": {
    "display": {
      "family": "'Segoe UI',Arial,sans-serif",
      "weight": 700
    },
    "body": {
      "family": "'Segoe UI',Arial,sans-serif",
      "weight": 600
    }
  },
  "chrome": {
    "kicker": false,
    "eyebrow": false
  }
}
