{
  "code": "DL-16",
  "name": "TELOS",
  "aka": "ANSWER",
  "ovp_version": "1.0",
  "status": "candidate",
  "philosophy": {
    "civilization": "Ancient Greece",
    "principle": "Purpose and resolution",
    "motto": "Every page serves a purpose.",
    "laws": [
      "Answer first",
      "Support with evidence",
      "Remove unnecessary detail",
      "Emphasize action",
      "End with clarity"
    ],
    "related": [
      "Resolution",
      "Sententia"
    ]
  },
  "constitution": {
    "narrative_style": "recommendation-first",
    "density": "executive",
    "annotation_policy": "minimal",
    "legend_policy": "direct-labels-only",
    "highlight_policy": "single",
    "decision_style": "recommendation-with-owner",
    "reading_time": "minute",
    "charts_per_page": 2
  },
  "occasions": [
    "results decks",
    "due-diligence readouts",
    "performance reviews"
  ],
  "palette": {
    "background": "#FFFFFF",
    "ink": "#1A1A1A",
    "body": "#444444",
    "hairline": "#D9D6D2",
    "gridline": "#E8E6E2",
    "primary": "#C4001A",
    "muted": "#B5B1AB",
    "benchmark": "#8C8880",
    "positive": "#2E6E4E",
    "negative": "#C4001A"
  },
  "fonts": {
    "display": {
      "family": "'Segoe UI',Arial,sans-serif",
      "weight": 700
    },
    "body": {
      "family": "'Segoe UI',Arial,sans-serif",
      "weight": 400
    }
  },
  "chrome": {
    "kicker": false,
    "eyebrow": false
  }
}
