{
  "code": "DL-09",
  "name": "ATLAS",
  "aka": "ATLAS",
  "ovp_version": "1.0",
  "status": "candidate",
  "philosophy": {
    "civilization": "Greek mythology and cartography",
    "principle": "Orientation",
    "motto": "Always know where you are.",
    "laws": [
      "Geography drives layout",
      "Exceptions dominate attention",
      "Routes tell progress",
      "Labels remain readable",
      "Maps are the visualization"
    ],
    "related": [
      "Meridian",
      "Qibla"
    ]
  },
  "constitution": {
    "narrative_style": "question-first",
    "density": "operational",
    "annotation_policy": "guided",
    "legend_policy": "level-key-allowed",
    "highlight_policy": "single",
    "decision_style": "evidence-only",
    "reading_time": "minute",
    "charts_per_page": 2
  },
  "occasions": [
    "route progress",
    "section and site status maps",
    "logistics corridors",
    "geo overviews"
  ],
  "palette": {
    "background": "#F4EFE6",
    "panel": "#EAE3D5",
    "ink": "#2B3A42",
    "body": "#4A5860",
    "hairline": "#CDC3AE",
    "gridline": "#E3DCCB",
    "primary": "#0F766E",
    "muted": "#B9AE9C",
    "positive": "#2E6E4E",
    "negative": "#C2410C",
    "water": "#D7E4E8"
  },
  "fonts": {
    "display": {
      "family": "'Segoe UI',Arial,sans-serif",
      "weight": 600
    },
    "body": {
      "family": "'Segoe UI',Arial,sans-serif",
      "weight": 400
    }
  },
  "chrome": {
    "kicker": false,
    "eyebrow": false
  }
}
